{
  "schema": 1,
  "dayStartHour": 4,
  "ladder": [1, 3, 7, 16, 35],
  "efMin": 1.3,
  "efMax": 2.8,
  "fuzz": 0.05,
  "newItemsPerDay": 8,
  "maxIntroducesPerLesson": 3,
  "productionAfterReps": 3,
  "obchodBatch": 15,
  "debtLockThreshold": 60,
  "phoneticPerDay": 5,
  "springAfterDays": 7,
  "expressMaxCards": 12,
  "expressMaxMin": 3,
  "sessionTargetMin": 12,
  "sessionSoftCapMin": 15,
  "resumeHours": 6,
  "remedy": { "errors": 3, "windowDays": 7, "cooldownDays": 3 },
  "clusters": { "green": 0.9, "yellow": 0.6, "closeScore": 0.9, "closeDays": 2, "closeMinAnswers": 5, "pairsPerCluster": 12 },
  "zloty": {
    "review": 1,
    "newItem": 3,
    "sceneFirst": 5,
    "express": 5,
    "orderBase": 10,
    "orderPerCard": 3,
    "orderMax": 25,
    "bossFirst": 100,
    "dailyCap": 120,
    "hint": 5
  },
  "pierogi": { "daily": 3, "carryMax": 1 },
  "hearts": { "base": 1, "perScene": 0.5, "perOrder": 0.25, "max": 5, "overdueGraceDays": 3, "floor": 0.4 },
  "jars": { "thresholds": [35, 90, 180] },
  "grade3FastMs": { "choice": 2500, "input": 6000 },
  "director": { "easyWins": 5, "more3Min": 3, "firstDayRepairIfActiveMinLt": 10 },
  "orders": { "perDay": 2, "itemsMin": 2, "itemsMax": 3, "earlyDays": 3, "deliveryBonus": 2, "stepLimitFactor": 1.5 },
  "kitchen": { "dailyMax": 1, "jarsPerRecipe": 3, "bonusItems": 4 },
  "market": { "enabled": false, "zlPerJar": 2, "dailyMax": 10 },
  "minigames": { "fishBiteDelayMs": [300, 900], "fishWindowMs": 700, "mineFloors": [1, 3, 7, 16, 35] }
}
